{
  "kind": "issue",
  "number": 523,
  "url": "https://github.com/OWASP/ASVS/issues/523",
  "title": "V5 - reorganize input validation, sanitze and encoding subcategories",
  "state": "closed",
  "created_at": "2019-02-22T08:12:49Z",
  "closed_at": null,
  "author": "elarlang",
  "participants": [
    "elarlang",
    "vanderaj"
  ],
  "labels": [],
  "source": {
    "snapshot": "sources/issues/523.json",
    "snapshot_digest": "sha256:5000841ce14999720c5f537db856e99da3ab741f04a6db3f3b8dcc1dbee5c3c9",
    "history_snapshot": null,
    "fetched_at": "2026-08-24T23:17:44Z",
    "comment_count": 1,
    "has_edits": false,
    "previous_digest": null
  },
  "triage": null,
  "summaries": [],
  "outcome": null,
  "requirement_summaries": [],
  "unmapped_topics": [],
  "external_references": [],
  "status": {
    "coverage": "linked",
    "last_pipeline_run": "2026-08-24T23:17:44Z",
    "last_human_review": null,
    "stale": false
  }
}
