{
  "kind": "issue",
  "number": 520,
  "url": "https://github.com/OWASP/ASVS/issues/520",
  "title": "Appendix B references QA notes",
  "state": "closed",
  "created_at": "2019-02-21T23:14:34Z",
  "closed_at": null,
  "author": "vanderaj",
  "participants": [
    "tkisason",
    "vanderaj"
  ],
  "labels": [],
  "source": {
    "snapshot": "sources/issues/520.json",
    "snapshot_digest": "sha256:64fbfcfbfcfd0a56327e88229791ac9bdf71e7a8038d89ebe6e81578fd710fa5",
    "history_snapshot": null,
    "fetched_at": "2026-08-24T23:17:44Z",
    "comment_count": 2,
    "has_edits": false,
    "previous_digest": null
  },
  "triage": null,
  "summaries": [],
  "outcome": null,
  "requirement_summaries": [],
  "unmapped_topics": [],
  "external_references": [],
  "status": {
    "coverage": "linked",
    "last_pipeline_run": "2026-08-24T23:17:44Z",
    "last_human_review": null,
    "stale": false
  }
}
