{
  "kind": "issue",
  "number": 3170,
  "url": "https://github.com/OWASP/ASVS/issues/3170",
  "title": "Update contributors ",
  "state": "closed",
  "created_at": "2025-05-30T06:42:04Z",
  "closed_at": null,
  "author": "tghosth",
  "participants": [
    "tghosth"
  ],
  "labels": [
    "6) PR awaiting review",
    "_5.0 - After Release"
  ],
  "source": {
    "snapshot": "sources/issues/3170.json",
    "snapshot_digest": "sha256:3c96927db2c3ee895baee0ce60291359687f8550bfe5de1f7eaeabe368637be9",
    "history_snapshot": null,
    "fetched_at": "2026-08-24T23:17:43Z",
    "comment_count": 0,
    "has_edits": false,
    "previous_digest": null
  },
  "triage": null,
  "summaries": [],
  "outcome": null,
  "requirement_summaries": [],
  "unmapped_topics": [],
  "external_references": [],
  "status": {
    "coverage": "empty",
    "last_pipeline_run": "2026-08-24T23:17:43Z",
    "last_human_review": null,
    "stale": false
  }
}
