{
  "kind": "issue",
  "number": 1744,
  "url": "https://github.com/OWASP/ASVS/issues/1744",
  "title": "Consideration for Right-To-Left-Override (RTLO) related vulnerabilities",
  "state": "closed",
  "created_at": "2023-10-04T19:53:34Z",
  "closed_at": null,
  "author": "ImanSharaf",
  "participants": [
    "ImanSharaf",
    "elarlang",
    "tghosth"
  ],
  "labels": [
    "_5.0 - prep",
    "Community wanted",
    "V1 (prev V5)",
    "4b Major-rework"
  ],
  "source": {
    "snapshot": "sources/issues/1744.json",
    "snapshot_digest": "sha256:64d9e2f6166bb0a278bc969de525f4b62aaf01a21829678b977305a73cb0ce1c",
    "history_snapshot": "sources/issues/1744.history.json",
    "fetched_at": "2026-08-24T23:17:43Z",
    "comment_count": 10,
    "has_edits": true,
    "previous_digest": null
  },
  "triage": null,
  "summaries": [],
  "outcome": null,
  "requirement_summaries": [],
  "unmapped_topics": [],
  "external_references": [],
  "status": {
    "coverage": "linked",
    "last_pipeline_run": "2026-08-24T23:17:43Z",
    "last_human_review": null,
    "stale": false
  }
}
