{
  "kind": "issue",
  "number": 2889,
  "url": "https://github.com/OWASP/ASVS/issues/2889",
  "title": "V15.4 TOCTUO - change to similar abbreviation",
  "state": "closed",
  "created_at": "2025-04-05T19:10:18Z",
  "closed_at": null,
  "author": "oleksiidov",
  "participants": [
    "elarlang",
    "oleksiidov",
    "tghosth"
  ],
  "labels": [
    "5) awaiting PR",
    "V15 (prev V10)",
    "_5.0 - rc1"
  ],
  "source": {
    "snapshot": "sources/issues/2889.json",
    "snapshot_digest": "sha256:ce0c6e0fe6bb81adbb5da2196858679f4489d2a9eca6787f12df455d1ee19529",
    "history_snapshot": "sources/issues/2889.history.json",
    "fetched_at": "2026-08-24T23:17:44Z",
    "comment_count": 6,
    "has_edits": true,
    "previous_digest": null
  },
  "triage": null,
  "summaries": [],
  "outcome": null,
  "requirement_summaries": [],
  "unmapped_topics": [],
  "external_references": [],
  "status": {
    "coverage": "linked",
    "last_pipeline_run": "2026-08-24T23:17:44Z",
    "last_human_review": null,
    "stale": false
  }
}
