{
  "kind": "issue",
  "number": 1611,
  "url": "https://github.com/OWASP/ASVS/issues/1611",
  "title": "Insert NIST \"Guidelines for Media Sanitization\" within IoT Appendix",
  "state": "closed",
  "created_at": "2023-04-11T10:34:50Z",
  "closed_at": null,
  "author": "cmlh",
  "participants": [
    "cmlh",
    "mgargiullo",
    "tghosth"
  ],
  "labels": [],
  "source": {
    "snapshot": "sources/issues/1611.json",
    "snapshot_digest": "sha256:73ec4c5c051a2ebeb5206d771177da320e4ea3490f87167454292efc74699826",
    "history_snapshot": "sources/issues/1611.history.json",
    "fetched_at": "2026-08-24T23:17:43Z",
    "comment_count": 7,
    "has_edits": true,
    "previous_digest": null
  },
  "triage": null,
  "summaries": [],
  "outcome": null,
  "requirement_summaries": [],
  "unmapped_topics": [],
  "external_references": [],
  "status": {
    "coverage": "empty",
    "last_pipeline_run": "2026-08-24T23:17:43Z",
    "last_human_review": null,
    "stale": false
  }
}
