{
  "kind": "issue",
  "number": 2497,
  "url": "https://github.com/OWASP/ASVS/issues/2497",
  "title": "Cryptography - suggested modification of 6.5.4",
  "state": "closed",
  "created_at": "2025-01-02T20:46:08Z",
  "closed_at": null,
  "author": "randomstuff",
  "participants": [
    "danielcuthbert",
    "randomstuff",
    "tghosth"
  ],
  "labels": [
    "6) PR awaiting review",
    "_5.0 - Not blocker",
    "AppendixV",
    "Bart Preneel"
  ],
  "source": {
    "snapshot": "sources/issues/2497.json",
    "snapshot_digest": "sha256:f0eff592759f56600c92d8a0ab7c90db3cc9dbc27a8d5f3205762564204aa602",
    "history_snapshot": "sources/issues/2497.history.json",
    "fetched_at": "2026-08-24T23:17:44Z",
    "comment_count": 13,
    "has_edits": true,
    "previous_digest": null
  },
  "triage": null,
  "summaries": [],
  "outcome": null,
  "requirement_summaries": [],
  "unmapped_topics": [],
  "external_references": [],
  "status": {
    "coverage": "linked",
    "last_pipeline_run": "2026-08-24T23:17:44Z",
    "last_human_review": null,
    "stale": false
  }
}
