{
  "kind": "issue",
  "number": 2112,
  "url": "https://github.com/OWASP/ASVS/issues/2112",
  "title": "v3.2.1 identifier rotating for a stateless mechanism",
  "state": "closed",
  "created_at": "2024-09-24T09:26:09Z",
  "closed_at": null,
  "author": "tghosth",
  "participants": [
    "elarlang",
    "ryarmst",
    "tghosth"
  ],
  "labels": [
    "1) Discussion ongoing",
    "_5.0 - prep",
    "Will be closed if no response/opposite arguments",
    "V7 (prev V3)"
  ],
  "source": {
    "snapshot": "sources/issues/2112.json",
    "snapshot_digest": "sha256:c80bed0d7be320f35cdea82d9d3aad7dbed498617338b7faf940e98322c7ab6e",
    "history_snapshot": null,
    "fetched_at": "2026-08-24T23:17:44Z",
    "comment_count": 7,
    "has_edits": false,
    "previous_digest": null
  },
  "triage": null,
  "summaries": [],
  "outcome": null,
  "requirement_summaries": [],
  "unmapped_topics": [],
  "external_references": [],
  "status": {
    "coverage": "linked",
    "last_pipeline_run": "2026-08-24T23:17:44Z",
    "last_human_review": null,
    "stale": false
  }
}
