{
  "kind": "issue",
  "number": 2974,
  "url": "https://github.com/OWASP/ASVS/issues/2974",
  "title": "Clarify 10.4.16 (v5.0.be-51.4.10)",
  "state": "closed",
  "created_at": "2025-04-17T08:42:25Z",
  "closed_at": null,
  "author": "tghosth",
  "participants": [
    "elarlang",
    "oleksiidov",
    "randomstuff",
    "tghosth"
  ],
  "labels": [
    "6) PR awaiting review",
    "V10 (prev V51)",
    "_5.0 - rc1"
  ],
  "source": {
    "snapshot": "sources/issues/2974.json",
    "snapshot_digest": "sha256:ef619d8c7c8709e1cc1050a67c9546700d02725bd208716250c6a6e2f6b162be",
    "history_snapshot": "sources/issues/2974.history.json",
    "fetched_at": "2026-08-24T23:17:43Z",
    "comment_count": 13,
    "has_edits": true,
    "previous_digest": null
  },
  "triage": null,
  "summaries": [],
  "outcome": null,
  "requirement_summaries": [],
  "unmapped_topics": [],
  "external_references": [],
  "status": {
    "coverage": "linked",
    "last_pipeline_run": "2026-08-24T23:17:43Z",
    "last_human_review": null,
    "stale": false
  }
}
