{
  "kind": "issue",
  "number": 3100,
  "url": "https://github.com/OWASP/ASVS/issues/3100",
  "title": "Level mismatch in V2",
  "state": "closed",
  "created_at": "2025-05-08T14:22:57Z",
  "closed_at": null,
  "author": "tghosth",
  "participants": [
    "elarlang",
    "tghosth"
  ],
  "labels": [
    "6) PR awaiting review",
    "V2 (prev V11)",
    "_5.0 - rc1"
  ],
  "source": {
    "snapshot": "sources/issues/3100.json",
    "snapshot_digest": "sha256:b3d257bcfba6047f62c34f2ef9cde7bebae3aa9813da5d81b4645d192f7da0c5",
    "history_snapshot": null,
    "fetched_at": "2026-08-24T23:17:44Z",
    "comment_count": 1,
    "has_edits": false,
    "previous_digest": null
  },
  "triage": null,
  "summaries": [],
  "outcome": null,
  "requirement_summaries": [],
  "unmapped_topics": [],
  "external_references": [],
  "status": {
    "coverage": "linked",
    "last_pipeline_run": "2026-08-24T23:17:44Z",
    "last_human_review": null,
    "stale": false
  }
}
