{
  "kind": "issue",
  "number": 1544,
  "url": "https://github.com/OWASP/ASVS/issues/1544",
  "title": "Expand 1.6.3",
  "state": "closed",
  "created_at": "2023-02-17T18:45:00Z",
  "closed_at": null,
  "author": "jmanico",
  "participants": [
    "danielcuthbert",
    "jmanico",
    "tghosth"
  ],
  "labels": [
    "_5.0 - prep",
    "4b Major-rework",
    "V11 (prev V6)"
  ],
  "source": {
    "snapshot": "sources/issues/1544.json",
    "snapshot_digest": "sha256:de27e924cee01feeb0f4b90048613ab84dce245d77d2a01f9b4f2db5a2a13acb",
    "history_snapshot": null,
    "fetched_at": "2026-08-24T23:17:43Z",
    "comment_count": 2,
    "has_edits": false,
    "previous_digest": null
  },
  "triage": null,
  "summaries": [],
  "outcome": null,
  "requirement_summaries": [],
  "unmapped_topics": [],
  "external_references": [],
  "status": {
    "coverage": "linked",
    "last_pipeline_run": "2026-08-24T23:17:43Z",
    "last_human_review": null,
    "stale": false
  }
}
