{
  "kind": "issue",
  "number": 2811,
  "url": "https://github.com/OWASP/ASVS/issues/2811",
  "title": "v5.0.be-5.3.11 / 1.2.9 - csv and formula injection wording",
  "state": "closed",
  "created_at": "2025-03-30T09:55:52Z",
  "closed_at": null,
  "author": "elarlang",
  "participants": [
    "elarlang",
    "tghosth"
  ],
  "labels": [
    "1) Discussion ongoing",
    "5) awaiting PR",
    "V1 (prev V5)",
    "_5.0 - rc1"
  ],
  "source": {
    "snapshot": "sources/issues/2811.json",
    "snapshot_digest": "sha256:63c7cbe6401be81a57962dd86cb564333398b13e2f955b0e9e3831f1d582852c",
    "history_snapshot": "sources/issues/2811.history.json",
    "fetched_at": "2026-08-24T23:17:44Z",
    "comment_count": 2,
    "has_edits": true,
    "previous_digest": null
  },
  "triage": null,
  "summaries": [],
  "outcome": null,
  "requirement_summaries": [],
  "unmapped_topics": [],
  "external_references": [],
  "status": {
    "coverage": "linked",
    "last_pipeline_run": "2026-08-24T23:17:44Z",
    "last_human_review": null,
    "stale": false
  }
}
