{
  "kind": "issue",
  "number": 2508,
  "url": "https://github.com/OWASP/ASVS/issues/2508",
  "title": "Turkish translation",
  "state": "closed",
  "created_at": "2025-01-08T11:30:36Z",
  "closed_at": null,
  "author": "ataseren",
  "participants": [
    "ataseren",
    "elarlang",
    "tghosth"
  ],
  "labels": [
    "translation",
    "_5.0 - Not blocker"
  ],
  "source": {
    "snapshot": "sources/issues/2508.json",
    "snapshot_digest": "sha256:c1ee25b5dbe7c342715586784ee68d3c7724dd9c1753958aaeade5056a96d134",
    "history_snapshot": "sources/issues/2508.history.json",
    "fetched_at": "2026-08-24T23:17:43Z",
    "comment_count": 3,
    "has_edits": true,
    "previous_digest": null
  },
  "triage": null,
  "summaries": [],
  "outcome": null,
  "requirement_summaries": [],
  "unmapped_topics": [],
  "external_references": [],
  "status": {
    "coverage": "empty",
    "last_pipeline_run": "2026-08-24T23:17:43Z",
    "last_human_review": null,
    "stale": false
  }
}
