{
  "kind": "issue",
  "number": 1087,
  "url": "https://github.com/OWASP/ASVS/issues/1087",
  "title": "clarification needed for 5.3.1 / v5.0.be-12.4.1",
  "state": "closed",
  "created_at": "2021-10-23T11:24:09Z",
  "closed_at": null,
  "author": "elarlang",
  "participants": [
    "cmlh",
    "elarlang",
    "jmanico",
    "randomstuff",
    "tghosth"
  ],
  "labels": [
    "6) PR awaiting review",
    "1) Discussion ongoing",
    "4b Major-rework",
    "V5 (prev V12)",
    "_5.0 - rc1"
  ],
  "source": {
    "snapshot": "sources/issues/1087.json",
    "snapshot_digest": "sha256:aaec44adb8268244e5f791b71bb812f0a365f3f296524d871fe7bd93f2c43c3b",
    "history_snapshot": "sources/issues/1087.history.json",
    "fetched_at": "2026-08-24T23:17:44Z",
    "comment_count": 57,
    "has_edits": true,
    "previous_digest": null
  },
  "triage": null,
  "summaries": [],
  "outcome": null,
  "requirement_summaries": [],
  "unmapped_topics": [],
  "external_references": [],
  "status": {
    "coverage": "linked",
    "last_pipeline_run": "2026-08-24T23:17:44Z",
    "last_human_review": null,
    "stale": false
  }
}
