{
  "kind": "issue",
  "number": 2595,
  "url": "https://github.com/OWASP/ASVS/issues/2595",
  "title": "Inconsistent requirements about number of bits of security",
  "state": "closed",
  "created_at": "2025-02-10T14:31:40Z",
  "closed_at": null,
  "author": "randomstuff",
  "participants": [
    "danielcuthbert",
    "elarlang",
    "jmanico",
    "randomstuff",
    "tghosth",
    "unprovable"
  ],
  "labels": [
    "1) Discussion ongoing",
    "_5.0 - prep",
    "Will be closed if no response/opposite arguments",
    "V11 (prev V6)"
  ],
  "source": {
    "snapshot": "sources/issues/2595.json",
    "snapshot_digest": "sha256:913f24525881024fc1eb71541a815a065a50b07a2128cab402c762b3e81a1d85",
    "history_snapshot": "sources/issues/2595.history.json",
    "fetched_at": "2026-08-24T23:17:43Z",
    "comment_count": 5,
    "has_edits": true,
    "previous_digest": null
  },
  "triage": null,
  "summaries": [],
  "outcome": null,
  "requirement_summaries": [],
  "unmapped_topics": [],
  "external_references": [],
  "status": {
    "coverage": "linked",
    "last_pipeline_run": "2026-08-24T23:17:43Z",
    "last_human_review": null,
    "stale": false
  }
}
