{
  "kind": "issue",
  "number": 2044,
  "url": "https://github.com/OWASP/ASVS/issues/2044",
  "title": "V51 OAuth: Add client verifications",
  "state": "closed",
  "created_at": "2024-08-31T15:07:17Z",
  "closed_at": null,
  "author": "TobiasAhnoff",
  "participants": [
    "TobiasAhnoff",
    "elarlang",
    "jmanico",
    "randomstuff"
  ],
  "labels": [
    "1) Discussion ongoing",
    "_5.0 - prep",
    "V10 (prev V51)"
  ],
  "source": {
    "snapshot": "sources/issues/2044.json",
    "snapshot_digest": "sha256:14b2069ffd94dc79ef3d750384a638022b5eba3ea688e39065a5e1862f1dc357",
    "history_snapshot": "sources/issues/2044.history.json",
    "fetched_at": "2026-08-24T23:17:44Z",
    "comment_count": 16,
    "has_edits": true,
    "previous_digest": null
  },
  "triage": null,
  "summaries": [],
  "outcome": null,
  "requirement_summaries": [],
  "unmapped_topics": [],
  "external_references": [],
  "status": {
    "coverage": "empty",
    "last_pipeline_run": "2026-08-24T23:17:44Z",
    "last_human_review": null,
    "stale": false
  }
}
