{
  "kind": "issue",
  "number": 2267,
  "url": "https://github.com/OWASP/ASVS/issues/2267",
  "title": "Consider Signed Exchanges for Content Integrity",
  "state": "closed",
  "created_at": "2024-11-05T17:04:33Z",
  "closed_at": null,
  "author": "ImanSharaf",
  "participants": [
    "ImanSharaf",
    "danielcuthbert",
    "jmanico",
    "tghosth"
  ],
  "labels": [
    "1) Discussion ongoing",
    "_5.0 - prep",
    "V3 (prev V50)"
  ],
  "source": {
    "snapshot": "sources/issues/2267.json",
    "snapshot_digest": "sha256:0e507faf658d6fe6aa42cbbc8b26783e487511d6bdae88678e916d2499f1f446",
    "history_snapshot": null,
    "fetched_at": "2026-08-24T23:17:44Z",
    "comment_count": 6,
    "has_edits": false,
    "previous_digest": null
  },
  "triage": null,
  "summaries": [],
  "outcome": null,
  "requirement_summaries": [],
  "unmapped_topics": [],
  "external_references": [],
  "status": {
    "coverage": "linked",
    "last_pipeline_run": "2026-08-24T23:17:44Z",
    "last_human_review": null,
    "stale": false
  }
}
