{
  "kind": "issue",
  "number": 26,
  "url": "https://github.com/OWASP/ASVS/issues/26",
  "title": "4.17 - aggregate access control protection needs refactoring",
  "state": "closed",
  "created_at": "2015-03-03T01:24:26Z",
  "closed_at": null,
  "author": "vanderaj",
  "participants": [
    "vanderaj"
  ],
  "labels": [],
  "source": {
    "snapshot": "sources/issues/26.json",
    "snapshot_digest": "sha256:25d061cb1414414cacf0c02b1c78b22d1f5aae51b7ce52faedb1c8ec988b47db",
    "history_snapshot": null,
    "fetched_at": "2026-08-24T23:17:44Z",
    "comment_count": 1,
    "has_edits": false,
    "previous_digest": null
  },
  "triage": null,
  "summaries": [],
  "outcome": null,
  "requirement_summaries": [],
  "unmapped_topics": [],
  "external_references": [],
  "status": {
    "coverage": "empty",
    "last_pipeline_run": "2026-08-24T23:17:44Z",
    "last_human_review": null,
    "stale": false
  }
}
