{
  "kind": "issue",
  "number": 2181,
  "url": "https://github.com/OWASP/ASVS/issues/2181",
  "title": "review V51.3.3 and V51.3.4",
  "state": "closed",
  "created_at": "2024-10-22T15:25:10Z",
  "closed_at": null,
  "author": "elarlang",
  "participants": [
    "elarlang",
    "randomstuff"
  ],
  "labels": [
    "1) Discussion ongoing",
    "4) proposal for review",
    "_5.0 - prep",
    "V10 (prev V51)"
  ],
  "source": {
    "snapshot": "sources/issues/2181.json",
    "snapshot_digest": "sha256:19c48aeeea48f8c9e104ae97acb03494c2535fd78c5324aa0d99718e48a02d5b",
    "history_snapshot": null,
    "fetched_at": "2026-08-24T23:17:43Z",
    "comment_count": 4,
    "has_edits": false,
    "previous_digest": null
  },
  "triage": null,
  "summaries": [],
  "outcome": null,
  "requirement_summaries": [],
  "unmapped_topics": [],
  "external_references": [],
  "status": {
    "coverage": "linked",
    "last_pipeline_run": "2026-08-24T23:17:43Z",
    "last_human_review": null,
    "stale": false
  }
}
