{
  "kind": "issue",
  "number": 801,
  "url": "https://github.com/OWASP/ASVS/issues/801",
  "title": "Use inclusive language",
  "state": "closed",
  "created_at": "2020-06-02T20:43:10Z",
  "closed_at": null,
  "author": "tghosth",
  "participants": [
    "danielcuthbert",
    "elarlang",
    "jmanico",
    "tghosth"
  ],
  "labels": [],
  "source": {
    "snapshot": "sources/issues/801.json",
    "snapshot_digest": "sha256:5d58943b0e62ff0b5996d58d17dc52db171f83603671412efc77bf33a7a15da1",
    "history_snapshot": "sources/issues/801.history.json",
    "fetched_at": "2026-08-24T23:17:44Z",
    "comment_count": 11,
    "has_edits": true,
    "previous_digest": null
  },
  "triage": null,
  "summaries": [],
  "outcome": null,
  "requirement_summaries": [],
  "unmapped_topics": [],
  "external_references": [],
  "status": {
    "coverage": "empty",
    "last_pipeline_run": "2026-08-24T23:17:44Z",
    "last_human_review": null,
    "stale": false
  }
}
