{
  "kind": "issue",
  "number": 18,
  "url": "https://github.com/OWASP/ASVS/issues/18",
  "title": "Page 16 – List of Requirement Areas Should Match the Section Header Wording ",
  "state": "closed",
  "created_at": "2014-11-20T18:27:10Z",
  "closed_at": null,
  "author": "defern",
  "participants": [
    "defern",
    "vanderaj"
  ],
  "labels": [],
  "source": {
    "snapshot": "sources/issues/18.json",
    "snapshot_digest": "sha256:752b3746327a8174efd6d6c28d6a21cf24ebe4b12735cf286ea32493741462a4",
    "history_snapshot": null,
    "fetched_at": "2026-08-24T23:17:44Z",
    "comment_count": 1,
    "has_edits": false,
    "previous_digest": null
  },
  "triage": null,
  "summaries": [],
  "outcome": null,
  "requirement_summaries": [],
  "unmapped_topics": [],
  "external_references": [],
  "status": {
    "coverage": "empty",
    "last_pipeline_run": "2026-08-24T23:17:44Z",
    "last_human_review": null,
    "stale": false
  }
}
