{
  "kind": "issue",
  "number": 223,
  "url": "https://github.com/OWASP/ASVS/issues/223",
  "title": "v11 never made it into the conversion",
  "state": "closed",
  "created_at": "2017-11-13T21:46:18Z",
  "closed_at": null,
  "author": "jmanico",
  "participants": [
    "jmanico",
    "vanderaj"
  ],
  "labels": [],
  "source": {
    "snapshot": "sources/issues/223.json",
    "snapshot_digest": "sha256:d59faa471a3f6a282f23a623d399f0fa36d3082fd8aa05ad5b2cdf334c1af298",
    "history_snapshot": null,
    "fetched_at": "2026-08-24T23:17:44Z",
    "comment_count": 1,
    "has_edits": false,
    "previous_digest": null
  },
  "triage": null,
  "summaries": [],
  "outcome": null,
  "requirement_summaries": [],
  "unmapped_topics": [],
  "external_references": [],
  "status": {
    "coverage": "empty",
    "last_pipeline_run": "2026-08-24T23:17:44Z",
    "last_human_review": null,
    "stale": false
  }
}
