{
  "kind": "issue",
  "number": 1005,
  "url": "https://github.com/OWASP/ASVS/issues/1005",
  "title": "1.8.X new requirements",
  "state": "closed",
  "created_at": "2021-05-26T08:09:11Z",
  "closed_at": null,
  "author": "mgeramb",
  "participants": [
    "elarlang",
    "jmanico",
    "mgeramb"
  ],
  "labels": [
    "2) Awaiting response"
  ],
  "source": {
    "snapshot": "sources/issues/1005.json",
    "snapshot_digest": "sha256:25e5b6ee15b4ab9049a612a71d2413bc224887f2960f1ce9d85dc3fc51d9453e",
    "history_snapshot": null,
    "fetched_at": "2026-08-24T23:17:44Z",
    "comment_count": 7,
    "has_edits": false,
    "previous_digest": null
  },
  "triage": null,
  "summaries": [],
  "outcome": null,
  "requirement_summaries": [],
  "unmapped_topics": [],
  "external_references": [],
  "status": {
    "coverage": "linked",
    "last_pipeline_run": "2026-08-24T23:17:44Z",
    "last_human_review": null,
    "stale": false
  }
}
