{
  "kind": "issue",
  "number": 2952,
  "url": "https://github.com/OWASP/ASVS/issues/2952",
  "title": "V13.3 requirements",
  "state": "closed",
  "created_at": "2025-04-12T11:19:25Z",
  "closed_at": null,
  "author": "elarlang",
  "participants": [
    "elarlang",
    "jmanico",
    "oleksiidov",
    "tghosth"
  ],
  "labels": [
    "5) awaiting PR",
    "V13 (prev V14)",
    "_5.0 - rc1"
  ],
  "source": {
    "snapshot": "sources/issues/2952.json",
    "snapshot_digest": "sha256:f04c3b93e63bbfd96a9b9ca264c83e78fa90ccecc59913bff52d5bc2a556f121",
    "history_snapshot": "sources/issues/2952.history.json",
    "fetched_at": "2026-08-24T23:17:44Z",
    "comment_count": 11,
    "has_edits": true,
    "previous_digest": null
  },
  "triage": null,
  "summaries": [],
  "outcome": null,
  "requirement_summaries": [],
  "unmapped_topics": [],
  "external_references": [],
  "status": {
    "coverage": "linked",
    "last_pipeline_run": "2026-08-24T23:17:44Z",
    "last_human_review": null,
    "stale": false
  }
}
